{
  "name": "Stone Steps 50K",
  "domain": "stonesteps50k.com",
  "tagline": "Cincinnati's longest running ultra marathon.",
  "contact": {
    "email": "",
    "phone": "",
    "address": "Mt. Airy Forest, 5083 Colerain Ave, Cincinnati, OH 45223"
  },
  "palette": {
    "theme": {
      "--color-primary": "#A83C26",
      "--color-primary-dark": "#8F3323",
      "--color-accent": "#1A1712",
      "--color-accent-dark": "#0F0D0A",
      "--color-secondary": "#8A7F66",
      "--color-tertiary": "#2E5738",
      "--color-bg": "#FBF6EA",
      "--color-bg-soft": "#F4EBD6",
      "--color-border-soft": "#E3D6B8",
      "--color-white-pure": "#FFFFFF"
    },
    "light": {
      "--background": "#FBF6EA",
      "--foreground": "#1A1712",
      "--card": "#FFEBBB",
      "--card-foreground": "#1A1712",
      "--popover": "#FFF7E4",
      "--popover-foreground": "#1A1712",
      "--primary": "#A83C26",
      "--primary-foreground": "#FFEBBB",
      "--secondary": "#2E5738",
      "--secondary-foreground": "#FFEBBB",
      "--muted": "#F4EBD6",
      "--muted-foreground": "#5C513B",
      "--accent": "#F0E6CE",
      "--accent-foreground": "#1A1712",
      "--border": "#E3D6B8",
      "--input": "#E3D6B8",
      "--ring": "#A83C26",
      "--link": "#8F3323",
      "--sidebar": "#FBF6EA",
      "--sidebar-foreground": "#1A1712",
      "--sidebar-primary": "#A83C26",
      "--sidebar-primary-foreground": "#FFEBBB",
      "--sidebar-accent": "#F4EBD6",
      "--sidebar-accent-foreground": "#1A1712",
      "--sidebar-border": "#E3D6B8",
      "--sidebar-ring": "#A83C26",
      "--tint-rgb": "168, 60, 38",
      "--primary-accent": "#8F3323",
      "--secondary-accent": "#24462D",
      "--info": "#2E5738",
      "--info-foreground": "#FFEBBB",
      "--success": "#24462D",
      "--success-foreground": "#FFEBBB",
      "--warning": "#8A6318",
      "--warning-foreground": "#FFEBBB",
      "--error": "#8F3323",
      "--error-foreground": "#FFEBBB",
      "--outline": "#1A1712"
    },
    "dark": {
      "--background": "#1A1712",
      "--foreground": "#FFEBBB",
      "--card": "#241F17",
      "--card-foreground": "#FFEBBB",
      "--popover": "#2F281D",
      "--popover-foreground": "#FFEBBB",
      "--primary": "#A83C26",
      "--primary-foreground": "#FFEBBB",
      "--secondary": "#2E5738",
      "--secondary-foreground": "#FFEBBB",
      "--muted": "#241F17",
      "--muted-foreground": "#C9B98F",
      "--accent": "#2F281D",
      "--accent-foreground": "#FED89B",
      "--border": "#3A3226",
      "--input": "#3A3226",
      "--ring": "#FED89B",
      "--link": "#FED89B",
      "--sidebar": "#1A1712",
      "--sidebar-foreground": "#FFEBBB",
      "--sidebar-primary": "#A83C26",
      "--sidebar-primary-foreground": "#FFEBBB",
      "--sidebar-accent": "#241F17",
      "--sidebar-accent-foreground": "#FED89B",
      "--sidebar-border": "#3A3226",
      "--sidebar-ring": "#FED89B",
      "--tint-rgb": "255, 235, 187",
      "--primary-accent": "#C9553A",
      "--secondary-accent": "#3E7049",
      "--info": "#9DC2A8",
      "--info-foreground": "#1A1712",
      "--success": "#9DC2A8",
      "--success-foreground": "#1A1712",
      "--warning": "#FED89B",
      "--warning-foreground": "#1A1712",
      "--error": "#E58A72",
      "--error-foreground": "#1A1712",
      "--outline": "#FFEBBB"
    }
  },
  "fonts": {
    "display": {
      "familyValue": "\"Staatliches\", \"Arial Narrow\", system-ui, sans-serif",
      "ogFontStack": "Staatliches, Arial Narrow, Impact, sans-serif",
      "imports": ["@fontsource/staatliches/400.css"]
    },
    "body": {
      "familyValue": "\"Archivo Variable\", system-ui, -apple-system, sans-serif",
      "ogFontStack": "Archivo, system-ui, sans-serif",
      "imports": ["@fontsource-variable/archivo", "@fontsource-variable/jetbrains-mono"]
    },
    "script": null
  },
  "radius": "0.75rem",
  "layout": {
    "header": "inline",
    "hero": "bleed",
    "density": "standard",
    "cards": "standard",
    "motion": "reveal"
  },
  "workerName": "stonesteps-50k",
  "logoPaths": {
    "light": "src/assets/logo-light.svg",
    "dark": "src/assets/logo-dark.svg"
  },
  "studio": {
    "fonts": {
      "display": "\"Staatliches\", \"Arial Narrow\", system-ui, sans-serif",
      "body": "\"Archivo Variable\", system-ui, -apple-system, sans-serif"
    },
    "chrome": "#24462D",
    "icons": {
      "types": {
        "race": "event",
        "raceDay": "event",
        "distance": "service",
        "scheduleItem": "times",
        "courseFeature": "place",
        "sponsor": "give",
        "athlete": "person",
        "raceResult": "document",
        "recordEntry": "value"
      },
      "tools": {
        "structure": "pages"
      },
      "tile": {
        "dark": "#D3C6AA"
      }
    },
    "look": {
      "headingColor": "#1A1712",
      "marker": { "src": "/studio-banner/mile-post.svg", "width": 26, "height": 40 },
      "markColors": ["#A83C26", "#2E5738", "#1A1712"],
      "stone": "square",
      "connector": {
        "kind": "dashes",
        "color": "#A83C26"
      },
      "tones": {
        "note": "#2E5738",
        "tip": "#FED89B",
        "careful": "#A83C26"
      },
      "motif": "/studio-banner/course-profile.svg",
      "motifNarrow": "/studio-banner/course-profile-phone.svg",
      "texture": "/studio-art/topo-tile.svg",
      "edgeColors": ["#2E5738", "#FED89B", "#A83C26", "#1A1712"],
      "lettering": {
        "family": "Staatliches",
        "src": "/fonts/staatliches-400.woff2",
        "colors": ["#FED89B"]
      },
      "motion": "lay"
    }
  }
}
